No.     Time           Source                Destination           Protocol Length Info
    722 56.971605849   127.0.0.1             127.0.0.1             TCP      74     54702 → 5011 [SYN] Seq=0 Win=43690 Len=0 MSS=65495 SACK_PERM=1 TSval=37420904 TSecr=0 WS=128

Frame 722: 74 bytes on wire (592 bits), 74 bytes captured (592 bits) on interface 0
Ethernet II, Src: 00:00:00_00:00:00 (00:00:00:00:00:00), Dst: 00:00:00_00:00:00 (00:00:00:00:00:00)
Internet Protocol Version 4, Src: 127.0.0.1, Dst: 127.0.0.1
Transmission Control Protocol, Src Port: 54702 (54702), Dst Port: 5011 (5011), Seq: 0, Len: 0

No.     Time           Source                Destination           Protocol Length Info
    723 56.971615000   127.0.0.1             127.0.0.1             TCP      74     5011 → 54702 [SYN, ACK] Seq=0 Ack=1 Win=43690 Len=0 MSS=65495 SACK_PERM=1 TSval=37420904 TSecr=37420904 WS=128

Frame 723: 74 bytes on wire (592 bits), 74 bytes captured (592 bits) on interface 0
Ethernet II, Src: 00:00:00_00:00:00 (00:00:00:00:00:00), Dst: 00:00:00_00:00:00 (00:00:00:00:00:00)
Internet Protocol Version 4, Src: 127.0.0.1, Dst: 127.0.0.1
Transmission Control Protocol, Src Port: 5011 (5011), Dst Port: 54702 (54702), Seq: 0, Ack: 1, Len: 0

No.     Time           Source                Destination           Protocol Length Info
    724 56.971623111   127.0.0.1             127.0.0.1             TCP      66     54702 → 5011 [ACK] Seq=1 Ack=1 Win=43776 Len=0 TSval=37420904 TSecr=37420904

Frame 724: 66 bytes on wire (528 bits), 66 bytes captured (528 bits) on interface 0
Ethernet II, Src: 00:00:00_00:00:00 (00:00:00:00:00:00), Dst: 00:00:00_00:00:00 (00:00:00:00:00:00)
Internet Protocol Version 4, Src: 127.0.0.1, Dst: 127.0.0.1
Transmission Control Protocol, Src Port: 54702 (54702), Dst Port: 5011 (5011), Seq: 1, Ack: 1, Len: 0

No.     Time           Source                Destination           Protocol Length Info
    725 57.076464059   127.0.0.1             127.0.0.1             HTTP     355    GET / HTTP/1.1 

Frame 725: 355 bytes on wire (2840 bits), 355 bytes captured (2840 bits) on interface 0
Ethernet II, Src: 00:00:00_00:00:00 (00:00:00:00:00:00), Dst: 00:00:00_00:00:00 (00:00:00:00:00:00)
Internet Protocol Version 4, Src: 127.0.0.1, Dst: 127.0.0.1
Transmission Control Protocol, Src Port: 54702 (54702), Dst Port: 5011 (5011), Seq: 1, Ack: 1, Len: 289
Hypertext Transfer Protocol
    GET / HTTP/1.1\r\n
        [Expert Info (Chat/Sequence): GET / HTTP/1.1\r\n]
        Request Method: GET
        Request URI: /
        Request Version: HTTP/1.1
    Host: jzkelb5g73g6q3wn.onion\r\n
    User-Agent: Mozilla/5.0 (Windows NT 6.1; rv:38.0) Gecko/20100101 Firefox/38.0\r\n
    Accept: text/html,application/xhtml+xml,application/xml;q=0.9,*/*;q=0.8\r\n
    Accept-Language: en-US,en;q=0.5\r\n
    Accept-Encoding: gzip, deflate\r\n
    Connection: keep-alive\r\n
    \r\n
    [Full request URI: http://jzkelb5g73g6q3wn.onion/]
    [HTTP request 1/1]
    [Response in frame: 731]

No.     Time           Source                Destination           Protocol Length Info
    726 57.076504812   127.0.0.1             127.0.0.1             TCP      66     5011 → 54702 [ACK] Seq=1 Ack=290 Win=44800 Len=0 TSval=37420936 TSecr=37420936

Frame 726: 66 bytes on wire (528 bits), 66 bytes captured (528 bits) on interface 0
Ethernet II, Src: 00:00:00_00:00:00 (00:00:00:00:00:00), Dst: 00:00:00_00:00:00 (00:00:00:00:00:00)
Internet Protocol Version 4, Src: 127.0.0.1, Dst: 127.0.0.1
Transmission Control Protocol, Src Port: 5011 (5011), Dst Port: 54702 (54702), Seq: 1, Ack: 290, Len: 0

No.     Time           Source                Destination           Protocol Length Info
    727 57.077779148   127.0.0.1             127.0.0.1             TCP      83     [TCP segment of a reassembled PDU]

Frame 727: 83 bytes on wire (664 bits), 83 bytes captured (664 bits) on interface 0
Ethernet II, Src: 00:00:00_00:00:00 (00:00:00:00:00:00), Dst: 00:00:00_00:00:00 (00:00:00:00:00:00)
Internet Protocol Version 4, Src: 127.0.0.1, Dst: 127.0.0.1
Transmission Control Protocol, Src Port: 5011 (5011), Dst Port: 54702 (54702), Seq: 1, Ack: 290, Len: 17

No.     Time           Source                Destination           Protocol Length Info
    728 57.077782982   127.0.0.1             127.0.0.1             TCP      66     54702 → 5011 [ACK] Seq=290 Ack=18 Win=43776 Len=0 TSval=37420936 TSecr=37420936

Frame 728: 66 bytes on wire (528 bits), 66 bytes captured (528 bits) on interface 0
Ethernet II, Src: 00:00:00_00:00:00 (00:00:00:00:00:00), Dst: 00:00:00_00:00:00 (00:00:00:00:00:00)
Internet Protocol Version 4, Src: 127.0.0.1, Dst: 127.0.0.1
Transmission Control Protocol, Src Port: 54702 (54702), Dst Port: 5011 (5011), Seq: 290, Ack: 18, Len: 0

No.     Time           Source                Destination           Protocol Length Info
    729 57.077837236   127.0.0.1             127.0.0.1             TCP      377    [TCP segment of a reassembled PDU]

Frame 729: 377 bytes on wire (3016 bits), 377 bytes captured (3016 bits) on interface 0
Ethernet II, Src: 00:00:00_00:00:00 (00:00:00:00:00:00), Dst: 00:00:00_00:00:00 (00:00:00:00:00:00)
Internet Protocol Version 4, Src: 127.0.0.1, Dst: 127.0.0.1
Transmission Control Protocol, Src Port: 5011 (5011), Dst Port: 54702 (54702), Seq: 18, Ack: 290, Len: 311

No.     Time           Source                Destination           Protocol Length Info
    730 57.077840034   127.0.0.1             127.0.0.1             TCP      66     54702 → 5011 [ACK] Seq=290 Ack=329 Win=44800 Len=0 TSval=37420936 TSecr=37420936

Frame 730: 66 bytes on wire (528 bits), 66 bytes captured (528 bits) on interface 0
Ethernet II, Src: 00:00:00_00:00:00 (00:00:00:00:00:00), Dst: 00:00:00_00:00:00 (00:00:00:00:00:00)
Internet Protocol Version 4, Src: 127.0.0.1, Dst: 127.0.0.1
Transmission Control Protocol, Src Port: 54702 (54702), Dst Port: 5011 (5011), Seq: 290, Ack: 329, Len: 0

No.     Time           Source                Destination           Protocol Length Info
    731 57.077855072   127.0.0.1             127.0.0.1             HTTP     5744   HTTP/1.0 200 OK  (text/html)

Frame 731: 5744 bytes on wire (45952 bits), 5744 bytes captured (45952 bits) on interface 0
Ethernet II, Src: 00:00:00_00:00:00 (00:00:00:00:00:00), Dst: 00:00:00_00:00:00 (00:00:00:00:00:00)
Internet Protocol Version 4, Src: 127.0.0.1, Dst: 127.0.0.1
Transmission Control Protocol, Src Port: 5011 (5011), Dst Port: 54702 (54702), Seq: 329, Ack: 290, Len: 5678
[3 Reassembled TCP Segments (6006 bytes): #727(17), #729(311), #731(5678)]
Hypertext Transfer Protocol
    HTTP/1.0 200 OK\r\n
        [Expert Info (Chat/Sequence): HTTP/1.0 200 OK\r\n]
        Request Version: HTTP/1.0
        Status Code: 200
        Response Phrase: OK
    Content-Length: 5678\r\n
    Content-Type: text/html; charset=utf-8\r\n
    Last-Modified: Sun, 10 Jan 2016 23:39:39 GMT\r\n
    Cache-Control: public, max-age=43200\r\n
    Expires: Thu, 17 Mar 2016 05:03:03 GMT\r\n
    ETag: "flask-1452469179.29708-5678-3619691419"\r\n
    Date: Wed, 16 Mar 2016 17:03:03 GMT\r\n
    Server: Werkzeug/0.11.4 Python/3.5.1\r\n
    \r\n
    [HTTP response 1/1]
    [Time since request: 0.001391013 seconds]
    [Request in frame: 725]
Line-based text data: text/html
    <!DOCTYPE html>\n
    <html lang="en">\n
      <head>\n
        <meta charset="utf-8">\n
        <meta http-equiv="X-UA-Compatible" content="IE=edge">\n
        <meta name="viewport" content="width=device-width, initial-scale=1">\n
    \n
        <!-- CSS -->\n
        <link rel="stylesheet" href="/bootstrap/css/bootstrap.min.css"></link>\n
        <link rel="stylesheet" href="/bootstrap/css/bootstrap-theme.min.css"></link>\n
        <link rel="stylesheet" href="/style.css"></link>\n
    \n
        <!-- Javascript -->\n
        <script src="/sjcl.js"></script>\n
        <script src="/openpgp.min.js"></script>\n
        <script src="/keys.js"></script>\n
        <script src="/app.js"></script>\n
      </head>\n
      <body onload="load()">\n
        <div class="container">\n
          <div class="page-header">\n
            <h1><span class="glyphicon glyphicon-bullhorn" aria-hidden="true"></span> Blow the whistle</h1>\n
            <p class="lead">\n
              Use the form below to submit sensitive information to our investigators.\n
              Using Tor you are not traceable by IP and data is encrypted before submission\n
              using PGP.\n
            </p>\n
            <p class="lead">\n
              Already submitted and waiting for a response? <a onclick="show_response_form()">Click here to see if\n
              there are any replies.</a>\n
            </p>\n
          </div>\n
    \n
          <div id="submission-form" class="well">\n
    \n
            <h2>Select Receivers</h2>\n
            <p>\n
              Select which journalists you wish to receive the content.\n
            </p>\n
            <div id="receivers" class="checkbox">\n
    \n
            </div>\n
    \n
    \n
    \n
    \n
          <h2>Content</h2>\n
          <p>Describe the leak that you are submitting.</p>\n
          <div class="form-group">\n
            <label for="short-title">\n
              Short title\n
            </label>\n
            <input type="text" class="form-control" id="short-title" name="short-title" required>\n
          </div>\n
    \n
          <div class="form-group">\n
            <label for="description">Description</label>\n
            <textarea id="description" class="form-control" name="description" required></textarea>\n
          </div>\n
    \n
          <div class="form-group">\n
            <label for="file">File</label>\n
            <input type="file" name="file" id="file-input" multiple>\n
            <p class="help-block">Currently we support files of up to 20 Mb.</p>\n
          </div>\n
    \n
          <div class="form-group">\n
            <label for="description">Contact</label>\n
            <span id="helpBlock" class="help-block">If you'd like, tell us how to contact you here.</span>\n
            <textarea id="description" class="form-control" name="description"></textarea>\n
          </div>\n
    \n
          <p>\n
            <input type="submit" class="btn btn-primary" onclick="return upload()" value="Upload">\n
          </p>\n
    \n
          <form method="POST" id="form" action="/" enctype="multipart/form-data">\n
            <input type="hidden" id="uploaded-file" name="uploaded-file">\n
          </form>\n
        </div>\n
    \n
        <div id="response-form" class="well">\n
          <form>\n
            <div class="form-group">\n
              <label for="codename">Codename</label>\n
              <span id="helpBlock" class="help-block">The codename you were assigned. This is your pseudonym used to identify you.</span>\n
              <input type="text" class="form-control" id="codename-input" name="codename" required>\n
            </div>\n
    \n
            <div class="form-group">\n
              <label for="file">Secret key</label>\n
              <input type="file" class="form-control" name="file" id="key-file-input">\n
              <span>or</span>\n
              <input type="text" class="form-control" name="keytext" id="key-text-input">\n
            </div>\n
    \n
            <p>\n
              <input type="submit" class="btn btn-primary" onclick="return show_response()" value="Fetch Response">\n
            </p>\n
          </form>\n
        </div>\n
    \n
        <div id="response" class="well">\n
          <!-- <div id="initial-submission">\n
    \n
          </div> -->\n
          <p id="reply-status"></p>\n
    \n
          <div id="reply">\n
              <table class="table table-bordered" id="replies">\n
              </table>\n
          </div>\n
    \n
          <form>\n
            <div class="form-group">\n
              <label for="reply">Reply</label>\n
              <textarea class="form-control" name="reply" id="reply-input"></textarea>\n
            </div>\n
    \n
            <p>\n
              <input type="submit" class="btn btn-primary" onclick="return send_reply()" value="Send">\n
            </p>\n
          </form>\n
        </div>\n
    \n
          <div id="progress" class="well">\n
              <p>\n
                Please wait while your submission is encrypted and uploaded.\n
              </p>\n
    \n
              <div class="progress">\n
                <div id="progress-bar" class="progress-bar progress-bar-striped active" role="progressbar" aria-valuenow="60" aria-valuemin="0" aria-valuemax="100" style="width: 100%;">\n
                  <span class="sr-only">60% Complete</span>\n
                </div>\n
              </div>\n
          </div>\n
    \n
          <div id="done" class="well">\n
            <p>Your submission has been received. Use the below codename and secret key\n
            to access replies.</p>\n
    \n
            <div class="row">\n
              <div class="well col-md-6">\n
                <h3>Codename</h3>\n
                <h4 id="codename"></h3>\n
                <span id="helpBlock" class="help-block">This is your pseudonym used to identify you in future communications.</span>\n
              </div>\n
    \n
              <div class="well col-md-6">\n
                <h3>Secret Key</h3>\n
    \n
                <div class="form-group">\n
                  <textarea id="keytext" class="form-control" readonly="true"></textarea>\n
                  <span id="helpBlock" class="help-block">The secret key used to encrypt/decrypt submissions sent between you and the journalist. Without it, you will not be able to read future messages.</span>\n
                </div>\n
    \n
                <p>\n
                  <button class="btn" id="keydownload">Download as file</button>\n
                </p>\n
    \n
              </div>\n
            </div>\n
          </div>\n
        </div>\n
      </body>\n
    </html>\n

No.     Time           Source                Destination           Protocol Length Info
    732 57.077858501   127.0.0.1             127.0.0.1             TCP      66     54702 → 5011 [ACK] Seq=290 Ack=6007 Win=175744 Len=0 TSval=37420936 TSecr=37420936

Frame 732: 66 bytes on wire (528 bits), 66 bytes captured (528 bits) on interface 0
Ethernet II, Src: 00:00:00_00:00:00 (00:00:00:00:00:00), Dst: 00:00:00_00:00:00 (00:00:00:00:00:00)
Internet Protocol Version 4, Src: 127.0.0.1, Dst: 127.0.0.1
Transmission Control Protocol, Src Port: 54702 (54702), Dst Port: 5011 (5011), Seq: 290, Ack: 6007, Len: 0

No.     Time           Source                Destination           Protocol Length Info
    733 57.077917921   127.0.0.1             127.0.0.1             TCP      66     5011 → 54702 [FIN, ACK] Seq=6007 Ack=290 Win=44800 Len=0 TSval=37420936 TSecr=37420936

Frame 733: 66 bytes on wire (528 bits), 66 bytes captured (528 bits) on interface 0
Ethernet II, Src: 00:00:00_00:00:00 (00:00:00:00:00:00), Dst: 00:00:00_00:00:00 (00:00:00:00:00:00)
Internet Protocol Version 4, Src: 127.0.0.1, Dst: 127.0.0.1
Transmission Control Protocol, Src Port: 5011 (5011), Dst Port: 54702 (54702), Seq: 6007, Ack: 290, Len: 0

No.     Time           Source                Destination           Protocol Length Info
    734 57.077950841   127.0.0.1             127.0.0.1             TCP      66     54702 → 5011 [FIN, ACK] Seq=290 Ack=6008 Win=175744 Len=0 TSval=37420936 TSecr=37420936

Frame 734: 66 bytes on wire (528 bits), 66 bytes captured (528 bits) on interface 0
Ethernet II, Src: 00:00:00_00:00:00 (00:00:00:00:00:00), Dst: 00:00:00_00:00:00 (00:00:00:00:00:00)
Internet Protocol Version 4, Src: 127.0.0.1, Dst: 127.0.0.1
Transmission Control Protocol, Src Port: 54702 (54702), Dst Port: 5011 (5011), Seq: 290, Ack: 6008, Len: 0

No.     Time           Source                Destination           Protocol Length Info
    735 57.077958380   127.0.0.1             127.0.0.1             TCP      66     5011 → 54702 [ACK] Seq=6008 Ack=291 Win=44800 Len=0 TSval=37420936 TSecr=37420936

Frame 735: 66 bytes on wire (528 bits), 66 bytes captured (528 bits) on interface 0
Ethernet II, Src: 00:00:00_00:00:00 (00:00:00:00:00:00), Dst: 00:00:00_00:00:00 (00:00:00:00:00:00)
Internet Protocol Version 4, Src: 127.0.0.1, Dst: 127.0.0.1
Transmission Control Protocol, Src Port: 5011 (5011), Dst Port: 54702 (54702), Seq: 6008, Ack: 291, Len: 0

No.     Time           Source                Destination           Protocol Length Info
    839 57.707042210   127.0.0.1             127.0.0.1             TCP      74     54716 → 5011 [SYN] Seq=0 Win=43690 Len=0 MSS=65495 SACK_PERM=1 TSval=37421125 TSecr=0 WS=128

Frame 839: 74 bytes on wire (592 bits), 74 bytes captured (592 bits) on interface 0
Ethernet II, Src: 00:00:00_00:00:00 (00:00:00:00:00:00), Dst: 00:00:00_00:00:00 (00:00:00:00:00:00)
Internet Protocol Version 4, Src: 127.0.0.1, Dst: 127.0.0.1
Transmission Control Protocol, Src Port: 54716 (54716), Dst Port: 5011 (5011), Seq: 0, Len: 0

No.     Time           Source                Destination           Protocol Length Info
    840 57.707052419   127.0.0.1             127.0.0.1             TCP      74     5011 → 54716 [SYN, ACK] Seq=0 Ack=1 Win=43690 Len=0 MSS=65495 SACK_PERM=1 TSval=37421125 TSecr=37421125 WS=128

Frame 840: 74 bytes on wire (592 bits), 74 bytes captured (592 bits) on interface 0
Ethernet II, Src: 00:00:00_00:00:00 (00:00:00:00:00:00), Dst: 00:00:00_00:00:00 (00:00:00:00:00:00)
Internet Protocol Version 4, Src: 127.0.0.1, Dst: 127.0.0.1
Transmission Control Protocol, Src Port: 5011 (5011), Dst Port: 54716 (54716), Seq: 0, Ack: 1, Len: 0

No.     Time           Source                Destination           Protocol Length Info
    841 57.707061475   127.0.0.1             127.0.0.1             TCP      66     54716 → 5011 [ACK] Seq=1 Ack=1 Win=43776 Len=0 TSval=37421125 TSecr=37421125

Frame 841: 66 bytes on wire (528 bits), 66 bytes captured (528 bits) on interface 0
Ethernet II, Src: 00:00:00_00:00:00 (00:00:00:00:00:00), Dst: 00:00:00_00:00:00 (00:00:00:00:00:00)
Internet Protocol Version 4, Src: 127.0.0.1, Dst: 127.0.0.1
Transmission Control Protocol, Src Port: 54716 (54716), Dst Port: 5011 (5011), Seq: 1, Ack: 1, Len: 0

No.     Time           Source                Destination           Protocol Length Info
    842 57.756463831   127.0.0.1             127.0.0.1             TCP      74     54718 → 5011 [SYN] Seq=0 Win=43690 Len=0 MSS=65495 SACK_PERM=1 TSval=37421140 TSecr=0 WS=128

Frame 842: 74 bytes on wire (592 bits), 74 bytes captured (592 bits) on interface 0
Ethernet II, Src: 00:00:00_00:00:00 (00:00:00:00:00:00), Dst: 00:00:00_00:00:00 (00:00:00:00:00:00)
Internet Protocol Version 4, Src: 127.0.0.1, Dst: 127.0.0.1
Transmission Control Protocol, Src Port: 54718 (54718), Dst Port: 5011 (5011), Seq: 0, Len: 0

No.     Time           Source                Destination           Protocol Length Info
    843 57.756471201   127.0.0.1             127.0.0.1             TCP      74     5011 → 54718 [SYN, ACK] Seq=0 Ack=1 Win=43690 Len=0 MSS=65495 SACK_PERM=1 TSval=37421140 TSecr=37421140 WS=128

Frame 843: 74 bytes on wire (592 bits), 74 bytes captured (592 bits) on interface 0
Ethernet II, Src: 00:00:00_00:00:00 (00:00:00:00:00:00), Dst: 00:00:00_00:00:00 (00:00:00:00:00:00)
Internet Protocol Version 4, Src: 127.0.0.1, Dst: 127.0.0.1
Transmission Control Protocol, Src Port: 5011 (5011), Dst Port: 54718 (54718), Seq: 0, Ack: 1, Len: 0

No.     Time           Source                Destination           Protocol Length Info
    844 57.756477845   127.0.0.1             127.0.0.1             TCP      66     54718 → 5011 [ACK] Seq=1 Ack=1 Win=43776 Len=0 TSval=37421140 TSecr=37421140

Frame 844: 66 bytes on wire (528 bits), 66 bytes captured (528 bits) on interface 0
Ethernet II, Src: 00:00:00_00:00:00 (00:00:00:00:00:00), Dst: 00:00:00_00:00:00 (00:00:00:00:00:00)
Internet Protocol Version 4, Src: 127.0.0.1, Dst: 127.0.0.1
Transmission Control Protocol, Src Port: 54718 (54718), Dst Port: 5011 (5011), Seq: 1, Ack: 1, Len: 0

No.     Time           Source                Destination           Protocol Length Info
    845 57.756490971   127.0.0.1             127.0.0.1             HTTP     382    GET /bootstrap/css/bootstrap.min.css HTTP/1.1 

Frame 845: 382 bytes on wire (3056 bits), 382 bytes captured (3056 bits) on interface 0
Ethernet II, Src: 00:00:00_00:00:00 (00:00:00:00:00:00), Dst: 00:00:00_00:00:00 (00:00:00:00:00:00)
Internet Protocol Version 4, Src: 127.0.0.1, Dst: 127.0.0.1
Transmission Control Protocol, Src Port: 54716 (54716), Dst Port: 5011 (5011), Seq: 1, Ack: 1, Len: 316
Hypertext Transfer Protocol
    GET /bootstrap/css/bootstrap.min.css HTTP/1.1\r\n
        [Expert Info (Chat/Sequence): GET /bootstrap/css/bootstrap.min.css HTTP/1.1\r\n]
        Request Method: GET
        Request URI: /bootstrap/css/bootstrap.min.css
        Request Version: HTTP/1.1
    Host: jzkelb5g73g6q3wn.onion\r\n
    User-Agent: Mozilla/5.0 (Windows NT 6.1; rv:38.0) Gecko/20100101 Firefox/38.0\r\n
    Accept: text/css,*/*;q=0.1\r\n
    Accept-Language: en-US,en;q=0.5\r\n
    Accept-Encoding: gzip, deflate\r\n
    Referer: http://jzkelb5g73g6q3wn.onion/\r\n
    Connection: keep-alive\r\n
    \r\n
    [Full request URI: http://jzkelb5g73g6q3wn.onion/bootstrap/css/bootstrap.min.css]
    [HTTP request 1/1]
    [Response in frame: 879]

No.     Time           Source                Destination           Protocol Length Info
    846 57.756530798   127.0.0.1             127.0.0.1             TCP      66     5011 → 54716 [ACK] Seq=1 Ack=317 Win=44800 Len=0 TSval=37421140 TSecr=37421140

Frame 846: 66 bytes on wire (528 bits), 66 bytes captured (528 bits) on interface 0
Ethernet II, Src: 00:00:00_00:00:00 (00:00:00:00:00:00), Dst: 00:00:00_00:00:00 (00:00:00:00:00:00)
Internet Protocol Version 4, Src: 127.0.0.1, Dst: 127.0.0.1
Transmission Control Protocol, Src Port: 5011 (5011), Dst Port: 54716 (54716), Seq: 1, Ack: 317, Len: 0

No.     Time           Source                Destination           Protocol Length Info
    847 57.757787258   127.0.0.1             127.0.0.1             TCP      83     [TCP segment of a reassembled PDU]

Frame 847: 83 bytes on wire (664 bits), 83 bytes captured (664 bits) on interface 0
Ethernet II, Src: 00:00:00_00:00:00 (00:00:00:00:00:00), Dst: 00:00:00_00:00:00 (00:00:00:00:00:00)
Internet Protocol Version 4, Src: 127.0.0.1, Dst: 127.0.0.1
Transmission Control Protocol, Src Port: 5011 (5011), Dst Port: 54716 (54716), Seq: 1, Ack: 317, Len: 17

No.     Time           Source                Destination           Protocol Length Info
    848 57.757790824   127.0.0.1             127.0.0.1             TCP      66     54716 → 5011 [ACK] Seq=317 Ack=18 Win=43776 Len=0 TSval=37421140 TSecr=37421140

Frame 848: 66 bytes on wire (528 bits), 66 bytes captured (528 bits) on interface 0
Ethernet II, Src: 00:00:00_00:00:00 (00:00:00:00:00:00), Dst: 00:00:00_00:00:00 (00:00:00:00:00:00)
Internet Protocol Version 4, Src: 127.0.0.1, Dst: 127.0.0.1
Transmission Control Protocol, Src Port: 54716 (54716), Dst Port: 5011 (5011), Seq: 317, Ack: 18, Len: 0

No.     Time           Source                Destination           Protocol Length Info
    849 57.757858403   127.0.0.1             127.0.0.1             TCP      382    [TCP segment of a reassembled PDU]

Frame 849: 382 bytes on wire (3056 bits), 382 bytes captured (3056 bits) on interface 0
Ethernet II, Src: 00:00:00_00:00:00 (00:00:00:00:00:00), Dst: 00:00:00_00:00:00 (00:00:00:00:00:00)
Internet Protocol Version 4, Src: 127.0.0.1, Dst: 127.0.0.1
Transmission Control Protocol, Src Port: 5011 (5011), Dst Port: 54716 (54716), Seq: 18, Ack: 317, Len: 316

No.     Time           Source                Destination           Protocol Length Info
    850 57.757861323   127.0.0.1             127.0.0.1             TCP      66     54716 → 5011 [ACK] Seq=317 Ack=334 Win=44800 Len=0 TSval=37421140 TSecr=37421140

Frame 850: 66 bytes on wire (528 bits), 66 bytes captured (528 bits) on interface 0
Ethernet II, Src: 00:00:00_00:00:00 (00:00:00:00:00:00), Dst: 00:00:00_00:00:00 (00:00:00:00:00:00)
Internet Protocol Version 4, Src: 127.0.0.1, Dst: 127.0.0.1
Transmission Control Protocol, Src Port: 54716 (54716), Dst Port: 5011 (5011), Seq: 317, Ack: 334, Len: 0

No.     Time           Source                Destination           Protocol Length Info
    851 57.757876800   127.0.0.1             127.0.0.1             TCP      8258   [TCP segment of a reassembled PDU]

Frame 851: 8258 bytes on wire (66064 bits), 8258 bytes captured (66064 bits) on interface 0
Ethernet II, Src: 00:00:00_00:00:00 (00:00:00:00:00:00), Dst: 00:00:00_00:00:00 (00:00:00:00:00:00)
Internet Protocol Version 4, Src: 127.0.0.1, Dst: 127.0.0.1
Transmission Control Protocol, Src Port: 5011 (5011), Dst Port: 54716 (54716), Seq: 334, Ack: 317, Len: 8192

No.     Time           Source                Destination           Protocol Length Info
    852 57.757880430   127.0.0.1             127.0.0.1             TCP      66     54716 → 5011 [ACK] Seq=317 Ack=8526 Win=175744 Len=0 TSval=37421140 TSecr=37421140

Frame 852: 66 bytes on wire (528 bits), 66 bytes captured (528 bits) on interface 0
Ethernet II, Src: 00:00:00_00:00:00 (00:00:00:00:00:00), Dst: 00:00:00_00:00:00 (00:00:00:00:00:00)
Internet Protocol Version 4, Src: 127.0.0.1, Dst: 127.0.0.1
Transmission Control Protocol, Src Port: 54716 (54716), Dst Port: 5011 (5011), Seq: 317, Ack: 8526, Len: 0

No.     Time           Source                Destination           Protocol Length Info
    853 57.757905135   127.0.0.1             127.0.0.1             TCP      8258   [TCP segment of a reassembled PDU]

Frame 853: 8258 bytes on wire (66064 bits), 8258 bytes captured (66064 bits) on interface 0
Ethernet II, Src: 00:00:00_00:00:00 (00:00:00:00:00:00), Dst: 00:00:00_00:00:00 (00:00:00:00:00:00)
Internet Protocol Version 4, Src: 127.0.0.1, Dst: 127.0.0.1
Transmission Control Protocol, Src Port: 5011 (5011), Dst Port: 54716 (54716), Seq: 8526, Ack: 317, Len: 8192

No.     Time           Source                Destination           Protocol Length Info
    854 57.757908134   127.0.0.1             127.0.0.1             TCP      66     54716 → 5011 [ACK] Seq=317 Ack=16718 Win=306816 Len=0 TSval=37421140 TSecr=37421140

Frame 854: 66 bytes on wire (528 bits), 66 bytes captured (528 bits) on interface 0
Ethernet II, Src: 00:00:00_00:00:00 (00:00:00:00:00:00), Dst: 00:00:00_00:00:00 (00:00:00:00:00:00)
Internet Protocol Version 4, Src: 127.0.0.1, Dst: 127.0.0.1
Transmission Control Protocol, Src Port: 54716 (54716), Dst Port: 5011 (5011), Seq: 317, Ack: 16718, Len: 0

No.     Time           Source                Destination           Protocol Length Info
    855 57.757928617   127.0.0.1             127.0.0.1             TCP      8258   [TCP segment of a reassembled PDU]

Frame 855: 8258 bytes on wire (66064 bits), 8258 bytes captured (66064 bits) on interface 0
Ethernet II, Src: 00:00:00_00:00:00 (00:00:00:00:00:00), Dst: 00:00:00_00:00:00 (00:00:00:00:00:00)
Internet Protocol Version 4, Src: 127.0.0.1, Dst: 127.0.0.1
Transmission Control Protocol, Src Port: 5011 (5011), Dst Port: 54716 (54716), Seq: 16718, Ack: 317, Len: 8192

No.     Time           Source                Destination           Protocol Length Info
    856 57.757932960   127.0.0.1             127.0.0.1             TCP      66     54716 → 5011 [ACK] Seq=317 Ack=24910 Win=437760 Len=0 TSval=37421140 TSecr=37421140

Frame 856: 66 bytes on wire (528 bits), 66 bytes captured (528 bits) on interface 0
Ethernet II, Src: 00:00:00_00:00:00 (00:00:00:00:00:00), Dst: 00:00:00_00:00:00 (00:00:00:00:00:00)
Internet Protocol Version 4, Src: 127.0.0.1, Dst: 127.0.0.1
Transmission Control Protocol, Src Port: 54716 (54716), Dst Port: 5011 (5011), Seq: 317, Ack: 24910, Len: 0

No.     Time           Source                Destination           Protocol Length Info
    857 57.757952470   127.0.0.1             127.0.0.1             TCP      8258   [TCP segment of a reassembled PDU]

Frame 857: 8258 bytes on wire (66064 bits), 8258 bytes captured (66064 bits) on interface 0
Ethernet II, Src: 00:00:00_00:00:00 (00:00:00:00:00:00), Dst: 00:00:00_00:00:00 (00:00:00:00:00:00)
Internet Protocol Version 4, Src: 127.0.0.1, Dst: 127.0.0.1
Transmission Control Protocol, Src Port: 5011 (5011), Dst Port: 54716 (54716), Seq: 24910, Ack: 317, Len: 8192

No.     Time           Source                Destination           Protocol Length Info
    858 57.757955532   127.0.0.1             127.0.0.1             TCP      66     54716 → 5011 [ACK] Seq=317 Ack=33102 Win=465536 Len=0 TSval=37421140 TSecr=37421140

Frame 858: 66 bytes on wire (528 bits), 66 bytes captured (528 bits) on interface 0
Ethernet II, Src: 00:00:00_00:00:00 (00:00:00:00:00:00), Dst: 00:00:00_00:00:00 (00:00:00:00:00:00)
Internet Protocol Version 4, Src: 127.0.0.1, Dst: 127.0.0.1
Transmission Control Protocol, Src Port: 54716 (54716), Dst Port: 5011 (5011), Seq: 317, Ack: 33102, Len: 0

No.     Time           Source                Destination           Protocol Length Info
    859 57.757975101   127.0.0.1             127.0.0.1             TCP      8258   [TCP segment of a reassembled PDU]

Frame 859: 8258 bytes on wire (66064 bits), 8258 bytes captured (66064 bits) on interface 0
Ethernet II, Src: 00:00:00_00:00:00 (00:00:00:00:00:00), Dst: 00:00:00_00:00:00 (00:00:00:00:00:00)
Internet Protocol Version 4, Src: 127.0.0.1, Dst: 127.0.0.1
Transmission Control Protocol, Src Port: 5011 (5011), Dst Port: 54716 (54716), Seq: 33102, Ack: 317, Len: 8192

No.     Time           Source                Destination           Protocol Length Info
    860 57.757977946   127.0.0.1             127.0.0.1             TCP      66     54716 → 5011 [ACK] Seq=317 Ack=41294 Win=465536 Len=0 TSval=37421140 TSecr=37421140

Frame 860: 66 bytes on wire (528 bits), 66 bytes captured (528 bits) on interface 0
Ethernet II, Src: 00:00:00_00:00:00 (00:00:00:00:00:00), Dst: 00:00:00_00:00:00 (00:00:00:00:00:00)
Internet Protocol Version 4, Src: 127.0.0.1, Dst: 127.0.0.1
Transmission Control Protocol, Src Port: 54716 (54716), Dst Port: 5011 (5011), Seq: 317, Ack: 41294, Len: 0

No.     Time           Source                Destination           Protocol Length Info
    861 57.757999295   127.0.0.1             127.0.0.1             TCP      8258   [TCP segment of a reassembled PDU]

Frame 861: 8258 bytes on wire (66064 bits), 8258 bytes captured (66064 bits) on interface 0
Ethernet II, Src: 00:00:00_00:00:00 (00:00:00:00:00:00), Dst: 00:00:00_00:00:00 (00:00:00:00:00:00)
Internet Protocol Version 4, Src: 127.0.0.1, Dst: 127.0.0.1
Transmission Control Protocol, Src Port: 5011 (5011), Dst Port: 54716 (54716), Seq: 41294, Ack: 317, Len: 8192

No.     Time           Source                Destination           Protocol Length Info
    862 57.758002656   127.0.0.1             127.0.0.1             TCP      66     54716 → 5011 [ACK] Seq=317 Ack=49486 Win=465536 Len=0 TSval=37421140 TSecr=37421140

Frame 862: 66 bytes on wire (528 bits), 66 bytes captured (528 bits) on interface 0
Ethernet II, Src: 00:00:00_00:00:00 (00:00:00:00:00:00), Dst: 00:00:00_00:00:00 (00:00:00:00:00:00)
Internet Protocol Version 4, Src: 127.0.0.1, Dst: 127.0.0.1
Transmission Control Protocol, Src Port: 54716 (54716), Dst Port: 5011 (5011), Seq: 317, Ack: 49486, Len: 0

No.     Time           Source                Destination           Protocol Length Info
    863 57.758023009   127.0.0.1             127.0.0.1             TCP      8258   [TCP segment of a reassembled PDU]

Frame 863: 8258 bytes on wire (66064 bits), 8258 bytes captured (66064 bits) on interface 0
Ethernet II, Src: 00:00:00_00:00:00 (00:00:00:00:00:00), Dst: 00:00:00_00:00:00 (00:00:00:00:00:00)
Internet Protocol Version 4, Src: 127.0.0.1, Dst: 127.0.0.1
Transmission Control Protocol, Src Port: 5011 (5011), Dst Port: 54716 (54716), Seq: 49486, Ack: 317, Len: 8192

No.     Time           Source                Destination           Protocol Length Info
    864 57.758025882   127.0.0.1             127.0.0.1             TCP      66     54716 → 5011 [ACK] Seq=317 Ack=57678 Win=465536 Len=0 TSval=37421140 TSecr=37421140

Frame 864: 66 bytes on wire (528 bits), 66 bytes captured (528 bits) on interface 0
Ethernet II, Src: 00:00:00_00:00:00 (00:00:00:00:00:00), Dst: 00:00:00_00:00:00 (00:00:00:00:00:00)
Internet Protocol Version 4, Src: 127.0.0.1, Dst: 127.0.0.1
Transmission Control Protocol, Src Port: 54716 (54716), Dst Port: 5011 (5011), Seq: 317, Ack: 57678, Len: 0

No.     Time           Source                Destination           Protocol Length Info
    865 57.758044979   127.0.0.1             127.0.0.1             TCP      8258   [TCP segment of a reassembled PDU]

Frame 865: 8258 bytes on wire (66064 bits), 8258 bytes captured (66064 bits) on interface 0
Ethernet II, Src: 00:00:00_00:00:00 (00:00:00:00:00:00), Dst: 00:00:00_00:00:00 (00:00:00:00:00:00)
Internet Protocol Version 4, Src: 127.0.0.1, Dst: 127.0.0.1
Transmission Control Protocol, Src Port: 5011 (5011), Dst Port: 54716 (54716), Seq: 57678, Ack: 317, Len: 8192

No.     Time           Source                Destination           Protocol Length Info
    866 57.758047715   127.0.0.1             127.0.0.1             TCP      66     54716 → 5011 [ACK] Seq=317 Ack=65870 Win=465536 Len=0 TSval=37421140 TSecr=37421140

Frame 866: 66 bytes on wire (528 bits), 66 bytes captured (528 bits) on interface 0
Ethernet II, Src: 00:00:00_00:00:00 (00:00:00:00:00:00), Dst: 00:00:00_00:00:00 (00:00:00:00:00:00)
Internet Protocol Version 4, Src: 127.0.0.1, Dst: 127.0.0.1
Transmission Control Protocol, Src Port: 54716 (54716), Dst Port: 5011 (5011), Seq: 317, Ack: 65870, Len: 0

No.     Time           Source                Destination           Protocol Length Info
    867 57.758066561   127.0.0.1             127.0.0.1             TCP      8258   [TCP segment of a reassembled PDU]

Frame 867: 8258 bytes on wire (66064 bits), 8258 bytes captured (66064 bits) on interface 0
Ethernet II, Src: 00:00:00_00:00:00 (00:00:00:00:00:00), Dst: 00:00:00_00:00:00 (00:00:00:00:00:00)
Internet Protocol Version 4, Src: 127.0.0.1, Dst: 127.0.0.1
Transmission Control Protocol, Src Port: 5011 (5011), Dst Port: 54716 (54716), Seq: 65870, Ack: 317, Len: 8192

No.     Time           Source                Destination           Protocol Length Info
    868 57.758070329   127.0.0.1             127.0.0.1             TCP      66     54716 → 5011 [ACK] Seq=317 Ack=74062 Win=465536 Len=0 TSval=37421140 TSecr=37421140

Frame 868: 66 bytes on wire (528 bits), 66 bytes captured (528 bits) on interface 0
Ethernet II, Src: 00:00:00_00:00:00 (00:00:00:00:00:00), Dst: 00:00:00_00:00:00 (00:00:00:00:00:00)
Internet Protocol Version 4, Src: 127.0.0.1, Dst: 127.0.0.1
Transmission Control Protocol, Src Port: 54716 (54716), Dst Port: 5011 (5011), Seq: 317, Ack: 74062, Len: 0

No.     Time           Source                Destination           Protocol Length Info
    869 57.758089319   127.0.0.1             127.0.0.1             TCP      8258   [TCP segment of a reassembled PDU]

Frame 869: 8258 bytes on wire (66064 bits), 8258 bytes captured (66064 bits) on interface 0
Ethernet II, Src: 00:00:00_00:00:00 (00:00:00:00:00:00), Dst: 00:00:00_00:00:00 (00:00:00:00:00:00)
Internet Protocol Version 4, Src: 127.0.0.1, Dst: 127.0.0.1
Transmission Control Protocol, Src Port: 5011 (5011), Dst Port: 54716 (54716), Seq: 74062, Ack: 317, Len: 8192

No.     Time           Source                Destination           Protocol Length Info
    870 57.758092520   127.0.0.1             127.0.0.1             TCP      66     54716 → 5011 [ACK] Seq=317 Ack=82254 Win=465536 Len=0 TSval=37421140 TSecr=37421140

Frame 870: 66 bytes on wire (528 bits), 66 bytes captured (528 bits) on interface 0
Ethernet II, Src: 00:00:00_00:00:00 (00:00:00:00:00:00), Dst: 00:00:00_00:00:00 (00:00:00:00:00:00)
Internet Protocol Version 4, Src: 127.0.0.1, Dst: 127.0.0.1
Transmission Control Protocol, Src Port: 54716 (54716), Dst Port: 5011 (5011), Seq: 317, Ack: 82254, Len: 0

No.     Time           Source                Destination           Protocol Length Info
    871 57.758112429   127.0.0.1             127.0.0.1             TCP      8258   [TCP segment of a reassembled PDU]

Frame 871: 8258 bytes on wire (66064 bits), 8258 bytes captured (66064 bits) on interface 0
Ethernet II, Src: 00:00:00_00:00:00 (00:00:00:00:00:00), Dst: 00:00:00_00:00:00 (00:00:00:00:00:00)
Internet Protocol Version 4, Src: 127.0.0.1, Dst: 127.0.0.1
Transmission Control Protocol, Src Port: 5011 (5011), Dst Port: 54716 (54716), Seq: 82254, Ack: 317, Len: 8192

No.     Time           Source                Destination           Protocol Length Info
    872 57.758115391   127.0.0.1             127.0.0.1             TCP      66     54716 → 5011 [ACK] Seq=317 Ack=90446 Win=465536 Len=0 TSval=37421140 TSecr=37421140

Frame 872: 66 bytes on wire (528 bits), 66 bytes captured (528 bits) on interface 0
Ethernet II, Src: 00:00:00_00:00:00 (00:00:00:00:00:00), Dst: 00:00:00_00:00:00 (00:00:00:00:00:00)
Internet Protocol Version 4, Src: 127.0.0.1, Dst: 127.0.0.1
Transmission Control Protocol, Src Port: 54716 (54716), Dst Port: 5011 (5011), Seq: 317, Ack: 90446, Len: 0

No.     Time           Source                Destination           Protocol Length Info
    873 57.758134886   127.0.0.1             127.0.0.1             TCP      8258   [TCP segment of a reassembled PDU]

Frame 873: 8258 bytes on wire (66064 bits), 8258 bytes captured (66064 bits) on interface 0
Ethernet II, Src: 00:00:00_00:00:00 (00:00:00:00:00:00), Dst: 00:00:00_00:00:00 (00:00:00:00:00:00)
Internet Protocol Version 4, Src: 127.0.0.1, Dst: 127.0.0.1
Transmission Control Protocol, Src Port: 5011 (5011), Dst Port: 54716 (54716), Seq: 90446, Ack: 317, Len: 8192

No.     Time           Source                Destination           Protocol Length Info
    874 57.758138141   127.0.0.1             127.0.0.1             TCP      66     54716 → 5011 [ACK] Seq=317 Ack=98638 Win=465536 Len=0 TSval=37421140 TSecr=37421140

Frame 874: 66 bytes on wire (528 bits), 66 bytes captured (528 bits) on interface 0
Ethernet II, Src: 00:00:00_00:00:00 (00:00:00:00:00:00), Dst: 00:00:00_00:00:00 (00:00:00:00:00:00)
Internet Protocol Version 4, Src: 127.0.0.1, Dst: 127.0.0.1
Transmission Control Protocol, Src Port: 54716 (54716), Dst Port: 5011 (5011), Seq: 317, Ack: 98638, Len: 0

No.     Time           Source                Destination           Protocol Length Info
    875 57.758157563   127.0.0.1             127.0.0.1             TCP      8258   [TCP segment of a reassembled PDU]

Frame 875: 8258 bytes on wire (66064 bits), 8258 bytes captured (66064 bits) on interface 0
Ethernet II, Src: 00:00:00_00:00:00 (00:00:00:00:00:00), Dst: 00:00:00_00:00:00 (00:00:00:00:00:00)
Internet Protocol Version 4, Src: 127.0.0.1, Dst: 127.0.0.1
Transmission Control Protocol, Src Port: 5011 (5011), Dst Port: 54716 (54716), Seq: 98638, Ack: 317, Len: 8192

No.     Time           Source                Destination           Protocol Length Info
    876 57.758160752   127.0.0.1             127.0.0.1             TCP      66     54716 → 5011 [ACK] Seq=317 Ack=106830 Win=465536 Len=0 TSval=37421140 TSecr=37421140

Frame 876: 66 bytes on wire (528 bits), 66 bytes captured (528 bits) on interface 0
Ethernet II, Src: 00:00:00_00:00:00 (00:00:00:00:00:00), Dst: 00:00:00_00:00:00 (00:00:00:00:00:00)
Internet Protocol Version 4, Src: 127.0.0.1, Dst: 127.0.0.1
Transmission Control Protocol, Src Port: 54716 (54716), Dst Port: 5011 (5011), Seq: 317, Ack: 106830, Len: 0

No.     Time           Source                Destination           Protocol Length Info
    877 57.758179430   127.0.0.1             127.0.0.1             TCP      8258   [TCP segment of a reassembled PDU]

Frame 877: 8258 bytes on wire (66064 bits), 8258 bytes captured (66064 bits) on interface 0
