No.     Time           Source                Destination           Protocol Length Info
    995 41.794743699   127.0.0.1             127.0.0.1             TCP      74     54944 → 5011 [SYN] Seq=0 Win=43690 Len=0 MSS=65495 SACK_PERM=1 TSval=37595160 TSecr=0 WS=128

Frame 995: 74 bytes on wire (592 bits), 74 bytes captured (592 bits) on interface 0
Ethernet II, Src: 00:00:00_00:00:00 (00:00:00:00:00:00), Dst: 00:00:00_00:00:00 (00:00:00:00:00:00)
Internet Protocol Version 4, Src: 127.0.0.1, Dst: 127.0.0.1
Transmission Control Protocol, Src Port: 54944 (54944), Dst Port: 5011 (5011), Seq: 0, Len: 0

No.     Time           Source                Destination           Protocol Length Info
    996 41.794753190   127.0.0.1             127.0.0.1             TCP      74     5011 → 54944 [SYN, ACK] Seq=0 Ack=1 Win=43690 Len=0 MSS=65495 SACK_PERM=1 TSval=37595160 TSecr=37595160 WS=128

Frame 996: 74 bytes on wire (592 bits), 74 bytes captured (592 bits) on interface 0
Ethernet II, Src: 00:00:00_00:00:00 (00:00:00:00:00:00), Dst: 00:00:00_00:00:00 (00:00:00:00:00:00)
Internet Protocol Version 4, Src: 127.0.0.1, Dst: 127.0.0.1
Transmission Control Protocol, Src Port: 5011 (5011), Dst Port: 54944 (54944), Seq: 0, Ack: 1, Len: 0

No.     Time           Source                Destination           Protocol Length Info
    997 41.794762463   127.0.0.1             127.0.0.1             TCP      66     54944 → 5011 [ACK] Seq=1 Ack=1 Win=43776 Len=0 TSval=37595160 TSecr=37595160

Frame 997: 66 bytes on wire (528 bits), 66 bytes captured (528 bits) on interface 0
Ethernet II, Src: 00:00:00_00:00:00 (00:00:00:00:00:00), Dst: 00:00:00_00:00:00 (00:00:00:00:00:00)
Internet Protocol Version 4, Src: 127.0.0.1, Dst: 127.0.0.1
Transmission Control Protocol, Src Port: 54944 (54944), Dst Port: 5011 (5011), Seq: 1, Ack: 1, Len: 0

No.     Time           Source                Destination           Protocol Length Info
    998 41.903799168   127.0.0.1             127.0.0.1             HTTP     355    GET / HTTP/1.1 

Frame 998: 355 bytes on wire (2840 bits), 355 bytes captured (2840 bits) on interface 0
Ethernet II, Src: 00:00:00_00:00:00 (00:00:00:00:00:00), Dst: 00:00:00_00:00:00 (00:00:00:00:00:00)
Internet Protocol Version 4, Src: 127.0.0.1, Dst: 127.0.0.1
Transmission Control Protocol, Src Port: 54944 (54944), Dst Port: 5011 (5011), Seq: 1, Ack: 1, Len: 289
Hypertext Transfer Protocol
    GET / HTTP/1.1\r\n
    Host: jzkelb5g73g6q3wn.onion\r\n
    User-Agent: Mozilla/5.0 (Windows NT 6.1; rv:38.0) Gecko/20100101 Firefox/38.0\r\n
    Accept: text/html,application/xhtml+xml,application/xml;q=0.9,*/*;q=0.8\r\n
    Accept-Language: en-US,en;q=0.5\r\n
    Accept-Encoding: gzip, deflate\r\n
    Connection: keep-alive\r\n
    \r\n
    [Full request URI: http://jzkelb5g73g6q3wn.onion/]
    [HTTP request 1/1]
    [Response in frame: 1004]

No.     Time           Source                Destination           Protocol Length Info
    999 41.903816862   127.0.0.1             127.0.0.1             TCP      66     5011 → 54944 [ACK] Seq=1 Ack=290 Win=44800 Len=0 TSval=37595193 TSecr=37595193

Frame 999: 66 bytes on wire (528 bits), 66 bytes captured (528 bits) on interface 0
Ethernet II, Src: 00:00:00_00:00:00 (00:00:00:00:00:00), Dst: 00:00:00_00:00:00 (00:00:00:00:00:00)
Internet Protocol Version 4, Src: 127.0.0.1, Dst: 127.0.0.1
Transmission Control Protocol, Src Port: 5011 (5011), Dst Port: 54944 (54944), Seq: 1, Ack: 290, Len: 0

No.     Time           Source                Destination           Protocol Length Info
   1000 41.905742763   127.0.0.1             127.0.0.1             TCP      83     [TCP segment of a reassembled PDU]

Frame 1000: 83 bytes on wire (664 bits), 83 bytes captured (664 bits) on interface 0
Ethernet II, Src: 00:00:00_00:00:00 (00:00:00:00:00:00), Dst: 00:00:00_00:00:00 (00:00:00:00:00:00)
Internet Protocol Version 4, Src: 127.0.0.1, Dst: 127.0.0.1
Transmission Control Protocol, Src Port: 5011 (5011), Dst Port: 54944 (54944), Seq: 1, Ack: 290, Len: 17

No.     Time           Source                Destination           Protocol Length Info
   1001 41.905747332   127.0.0.1             127.0.0.1             TCP      66     54944 → 5011 [ACK] Seq=290 Ack=18 Win=43776 Len=0 TSval=37595193 TSecr=37595193

Frame 1001: 66 bytes on wire (528 bits), 66 bytes captured (528 bits) on interface 0
Ethernet II, Src: 00:00:00_00:00:00 (00:00:00:00:00:00), Dst: 00:00:00_00:00:00 (00:00:00:00:00:00)
Internet Protocol Version 4, Src: 127.0.0.1, Dst: 127.0.0.1
Transmission Control Protocol, Src Port: 54944 (54944), Dst Port: 5011 (5011), Seq: 290, Ack: 18, Len: 0

No.     Time           Source                Destination           Protocol Length Info
   1002 41.905803364   127.0.0.1             127.0.0.1             TCP      377    [TCP segment of a reassembled PDU]

Frame 1002: 377 bytes on wire (3016 bits), 377 bytes captured (3016 bits) on interface 0
Ethernet II, Src: 00:00:00_00:00:00 (00:00:00:00:00:00), Dst: 00:00:00_00:00:00 (00:00:00:00:00:00)
Internet Protocol Version 4, Src: 127.0.0.1, Dst: 127.0.0.1
Transmission Control Protocol, Src Port: 5011 (5011), Dst Port: 54944 (54944), Seq: 18, Ack: 290, Len: 311

No.     Time           Source                Destination           Protocol Length Info
   1003 41.905806249   127.0.0.1             127.0.0.1             TCP      66     54944 → 5011 [ACK] Seq=290 Ack=329 Win=44800 Len=0 TSval=37595193 TSecr=37595193

Frame 1003: 66 bytes on wire (528 bits), 66 bytes captured (528 bits) on interface 0
Ethernet II, Src: 00:00:00_00:00:00 (00:00:00:00:00:00), Dst: 00:00:00_00:00:00 (00:00:00:00:00:00)
Internet Protocol Version 4, Src: 127.0.0.1, Dst: 127.0.0.1
Transmission Control Protocol, Src Port: 54944 (54944), Dst Port: 5011 (5011), Seq: 290, Ack: 329, Len: 0

No.     Time           Source                Destination           Protocol Length Info
   1004 41.905821176   127.0.0.1             127.0.0.1             HTTP     5744   HTTP/1.0 200 OK  (text/html)

Frame 1004: 5744 bytes on wire (45952 bits), 5744 bytes captured (45952 bits) on interface 0
Ethernet II, Src: 00:00:00_00:00:00 (00:00:00:00:00:00), Dst: 00:00:00_00:00:00 (00:00:00:00:00:00)
Internet Protocol Version 4, Src: 127.0.0.1, Dst: 127.0.0.1
Transmission Control Protocol, Src Port: 5011 (5011), Dst Port: 54944 (54944), Seq: 329, Ack: 290, Len: 5678
[3 Reassembled TCP Segments (6006 bytes): #1000(17), #1002(311), #1004(5678)]
Hypertext Transfer Protocol
    HTTP/1.0 200 OK\r\n
    Content-Length: 5678\r\n
    Content-Type: text/html; charset=utf-8\r\n
    Last-Modified: Sun, 10 Jan 2016 23:39:39 GMT\r\n
    Cache-Control: public, max-age=43200\r\n
    Expires: Thu, 17 Mar 2016 05:12:44 GMT\r\n
    ETag: "flask-1452469179.29708-5678-3619691419"\r\n
    Date: Wed, 16 Mar 2016 17:12:44 GMT\r\n
    Server: Werkzeug/0.11.4 Python/3.5.1\r\n
    \r\n
    [HTTP response 1/1]
    [Time since request: 0.002022008 seconds]
    [Request in frame: 998]
Line-based text data: text/html
    <!DOCTYPE html>\n
    <html lang="en">\n
      <head>\n
        <meta charset="utf-8">\n
        <meta http-equiv="X-UA-Compatible" content="IE=edge">\n
        <meta name="viewport" content="width=device-width, initial-scale=1">\n
    \n
        <!-- CSS -->\n
        <link rel="stylesheet" href="/bootstrap/css/bootstrap.min.css"></link>\n
        <link rel="stylesheet" href="/bootstrap/css/bootstrap-theme.min.css"></link>\n
        <link rel="stylesheet" href="/style.css"></link>\n
    \n
        <!-- Javascript -->\n
        <script src="/sjcl.js"></script>\n
        <script src="/openpgp.min.js"></script>\n
        <script src="/keys.js"></script>\n
        <script src="/app.js"></script>\n
      </head>\n
      <body onload="load()">\n
        <div class="container">\n
          <div class="page-header">\n
            <h1><span class="glyphicon glyphicon-bullhorn" aria-hidden="true"></span> Blow the whistle</h1>\n
            <p class="lead">\n
              Use the form below to submit sensitive information to our investigators.\n
              Using Tor you are not traceable by IP and data is encrypted before submission\n
              using PGP.\n
            </p>\n
            <p class="lead">\n
              Already submitted and waiting for a response? <a onclick="show_response_form()">Click here to see if\n
              there are any replies.</a>\n
            </p>\n
          </div>\n
    \n
          <div id="submission-form" class="well">\n
    \n
            <h2>Select Receivers</h2>\n
            <p>\n
              Select which journalists you wish to receive the content.\n
            </p>\n
            <div id="receivers" class="checkbox">\n
    \n
            </div>\n
    \n
    \n
    \n
    \n
          <h2>Content</h2>\n
          <p>Describe the leak that you are submitting.</p>\n
          <div class="form-group">\n
            <label for="short-title">\n
              Short title\n
            </label>\n
            <input type="text" class="form-control" id="short-title" name="short-title" required>\n
          </div>\n
    \n
          <div class="form-group">\n
            <label for="description">Description</label>\n
            <textarea id="description" class="form-control" name="description" required></textarea>\n
          </div>\n
    \n
          <div class="form-group">\n
            <label for="file">File</label>\n
            <input type="file" name="file" id="file-input" multiple>\n
            <p class="help-block">Currently we support files of up to 20 Mb.</p>\n
          </div>\n
    \n
          <div class="form-group">\n
            <label for="description">Contact</label>\n
            <span id="helpBlock" class="help-block">If you'd like, tell us how to contact you here.</span>\n
            <textarea id="description" class="form-control" name="description"></textarea>\n
          </div>\n
    \n
          <p>\n
            <input type="submit" class="btn btn-primary" onclick="return upload()" value="Upload">\n
          </p>\n
    \n
          <form method="POST" id="form" action="/" enctype="multipart/form-data">\n
            <input type="hidden" id="uploaded-file" name="uploaded-file">\n
          </form>\n
        </div>\n
    \n
        <div id="response-form" class="well">\n
          <form>\n
            <div class="form-group">\n
              <label for="codename">Codename</label>\n
              <span id="helpBlock" class="help-block">The codename you were assigned. This is your pseudonym used to identify you.</span>\n
              <input type="text" class="form-control" id="codename-input" name="codename" required>\n
            </div>\n
    \n
            <div class="form-group">\n
              <label for="file">Secret key</label>\n
              <input type="file" class="form-control" name="file" id="key-file-input">\n
              <span>or</span>\n
              <input type="text" class="form-control" name="keytext" id="key-text-input">\n
            </div>\n
    \n
            <p>\n
              <input type="submit" class="btn btn-primary" onclick="return show_response()" value="Fetch Response">\n
            </p>\n
          </form>\n
        </div>\n
    \n
        <div id="response" class="well">\n
          <!-- <div id="initial-submission">\n
    \n
          </div> -->\n
          <p id="reply-status"></p>\n
    \n
          <div id="reply">\n
              <table class="table table-bordered" id="replies">\n
              </table>\n
          </div>\n
    \n
          <form>\n
            <div class="form-group">\n
              <label for="reply">Reply</label>\n
              <textarea class="form-control" name="reply" id="reply-input"></textarea>\n
            </div>\n
    \n
            <p>\n
              <input type="submit" class="btn btn-primary" onclick="return send_reply()" value="Send">\n
            </p>\n
          </form>\n
        </div>\n
    \n
          <div id="progress" class="well">\n
              <p>\n
                Please wait while your submission is encrypted and uploaded.\n
              </p>\n
    \n
              <div class="progress">\n
                <div id="progress-bar" class="progress-bar progress-bar-striped active" role="progressbar" aria-valuenow="60" aria-valuemin="0" aria-valuemax="100" style="width: 100%;">\n
                  <span class="sr-only">60% Complete</span>\n
                </div>\n
              </div>\n
          </div>\n
    \n
          <div id="done" class="well">\n
            <p>Your submission has been received. Use the below codename and secret key\n
            to access replies.</p>\n
    \n
            <div class="row">\n
              <div class="well col-md-6">\n
                <h3>Codename</h3>\n
                <h4 id="codename"></h3>\n
                <span id="helpBlock" class="help-block">This is your pseudonym used to identify you in future communications.</span>\n
              </div>\n
    \n
              <div class="well col-md-6">\n
                <h3>Secret Key</h3>\n
    \n
                <div class="form-group">\n
                  <textarea id="keytext" class="form-control" readonly="true"></textarea>\n
                  <span id="helpBlock" class="help-block">The secret key used to encrypt/decrypt submissions sent between you and the journalist. Without it, you will not be able to read future messages.</span>\n
                </div>\n
    \n
                <p>\n
                  <button class="btn" id="keydownload">Download as file</button>\n
                </p>\n
    \n
              </div>\n
            </div>\n
          </div>\n
        </div>\n
      </body>\n
    </html>\n

No.     Time           Source                Destination           Protocol Length Info
   1005 41.905824397   127.0.0.1             127.0.0.1             TCP      66     54944 → 5011 [ACK] Seq=290 Ack=6007 Win=175744 Len=0 TSval=37595193 TSecr=37595193

Frame 1005: 66 bytes on wire (528 bits), 66 bytes captured (528 bits) on interface 0
Ethernet II, Src: 00:00:00_00:00:00 (00:00:00:00:00:00), Dst: 00:00:00_00:00:00 (00:00:00:00:00:00)
Internet Protocol Version 4, Src: 127.0.0.1, Dst: 127.0.0.1
Transmission Control Protocol, Src Port: 54944 (54944), Dst Port: 5011 (5011), Seq: 290, Ack: 6007, Len: 0

No.     Time           Source                Destination           Protocol Length Info
   1006 41.905888585   127.0.0.1             127.0.0.1             TCP      66     5011 → 54944 [FIN, ACK] Seq=6007 Ack=290 Win=44800 Len=0 TSval=37595193 TSecr=37595193

Frame 1006: 66 bytes on wire (528 bits), 66 bytes captured (528 bits) on interface 0
Ethernet II, Src: 00:00:00_00:00:00 (00:00:00:00:00:00), Dst: 00:00:00_00:00:00 (00:00:00:00:00:00)
Internet Protocol Version 4, Src: 127.0.0.1, Dst: 127.0.0.1
Transmission Control Protocol, Src Port: 5011 (5011), Dst Port: 54944 (54944), Seq: 6007, Ack: 290, Len: 0

No.     Time           Source                Destination           Protocol Length Info
   1007 41.905917044   127.0.0.1             127.0.0.1             TCP      66     54944 → 5011 [FIN, ACK] Seq=290 Ack=6008 Win=175744 Len=0 TSval=37595193 TSecr=37595193

Frame 1007: 66 bytes on wire (528 bits), 66 bytes captured (528 bits) on interface 0
Ethernet II, Src: 00:00:00_00:00:00 (00:00:00:00:00:00), Dst: 00:00:00_00:00:00 (00:00:00:00:00:00)
Internet Protocol Version 4, Src: 127.0.0.1, Dst: 127.0.0.1
Transmission Control Protocol, Src Port: 54944 (54944), Dst Port: 5011 (5011), Seq: 290, Ack: 6008, Len: 0

No.     Time           Source                Destination           Protocol Length Info
   1008 41.905923828   127.0.0.1             127.0.0.1             TCP      66     5011 → 54944 [ACK] Seq=6008 Ack=291 Win=44800 Len=0 TSval=37595193 TSecr=37595193

Frame 1008: 66 bytes on wire (528 bits), 66 bytes captured (528 bits) on interface 0
Ethernet II, Src: 00:00:00_00:00:00 (00:00:00:00:00:00), Dst: 00:00:00_00:00:00 (00:00:00:00:00:00)
Internet Protocol Version 4, Src: 127.0.0.1, Dst: 127.0.0.1
Transmission Control Protocol, Src Port: 5011 (5011), Dst Port: 54944 (54944), Seq: 6008, Ack: 291, Len: 0

No.     Time           Source                Destination           Protocol Length Info
   1115 42.591016239   127.0.0.1             127.0.0.1             TCP      74     54958 → 5011 [SYN] Seq=0 Win=43690 Len=0 MSS=65495 SACK_PERM=1 TSval=37595399 TSecr=0 WS=128

Frame 1115: 74 bytes on wire (592 bits), 74 bytes captured (592 bits) on interface 0
Ethernet II, Src: 00:00:00_00:00:00 (00:00:00:00:00:00), Dst: 00:00:00_00:00:00 (00:00:00:00:00:00)
Internet Protocol Version 4, Src: 127.0.0.1, Dst: 127.0.0.1
Transmission Control Protocol, Src Port: 54958 (54958), Dst Port: 5011 (5011), Seq: 0, Len: 0

No.     Time           Source                Destination           Protocol Length Info
   1116 42.591024722   127.0.0.1             127.0.0.1             TCP      74     5011 → 54958 [SYN, ACK] Seq=0 Ack=1 Win=43690 Len=0 MSS=65495 SACK_PERM=1 TSval=37595399 TSecr=37595399 WS=128

Frame 1116: 74 bytes on wire (592 bits), 74 bytes captured (592 bits) on interface 0
Ethernet II, Src: 00:00:00_00:00:00 (00:00:00:00:00:00), Dst: 00:00:00_00:00:00 (00:00:00:00:00:00)
Internet Protocol Version 4, Src: 127.0.0.1, Dst: 127.0.0.1
Transmission Control Protocol, Src Port: 5011 (5011), Dst Port: 54958 (54958), Seq: 0, Ack: 1, Len: 0

No.     Time           Source                Destination           Protocol Length Info
   1117 42.591033097   127.0.0.1             127.0.0.1             TCP      66     54958 → 5011 [ACK] Seq=1 Ack=1 Win=43776 Len=0 TSval=37595399 TSecr=37595399

Frame 1117: 66 bytes on wire (528 bits), 66 bytes captured (528 bits) on interface 0
Ethernet II, Src: 00:00:00_00:00:00 (00:00:00:00:00:00), Dst: 00:00:00_00:00:00 (00:00:00:00:00:00)
Internet Protocol Version 4, Src: 127.0.0.1, Dst: 127.0.0.1
Transmission Control Protocol, Src Port: 54958 (54958), Dst Port: 5011 (5011), Seq: 1, Ack: 1, Len: 0

No.     Time           Source                Destination           Protocol Length Info
   1118 42.651629342   127.0.0.1             127.0.0.1             HTTP     382    GET /bootstrap/css/bootstrap.min.css HTTP/1.1 

Frame 1118: 382 bytes on wire (3056 bits), 382 bytes captured (3056 bits) on interface 0
Ethernet II, Src: 00:00:00_00:00:00 (00:00:00:00:00:00), Dst: 00:00:00_00:00:00 (00:00:00:00:00:00)
Internet Protocol Version 4, Src: 127.0.0.1, Dst: 127.0.0.1
Transmission Control Protocol, Src Port: 54958 (54958), Dst Port: 5011 (5011), Seq: 1, Ack: 1, Len: 316
Hypertext Transfer Protocol
    GET /bootstrap/css/bootstrap.min.css HTTP/1.1\r\n
    Host: jzkelb5g73g6q3wn.onion\r\n
    User-Agent: Mozilla/5.0 (Windows NT 6.1; rv:38.0) Gecko/20100101 Firefox/38.0\r\n
    Accept: text/css,*/*;q=0.1\r\n
    Accept-Language: en-US,en;q=0.5\r\n
    Accept-Encoding: gzip, deflate\r\n
    Referer: http://jzkelb5g73g6q3wn.onion/\r\n
    Connection: keep-alive\r\n
    \r\n
    [Full request URI: http://jzkelb5g73g6q3wn.onion/bootstrap/css/bootstrap.min.css]
    [HTTP request 1/1]
    [Response in frame: 1152]

No.     Time           Source                Destination           Protocol Length Info
   1119 42.651670548   127.0.0.1             127.0.0.1             TCP      66     5011 → 54958 [ACK] Seq=1 Ack=317 Win=44800 Len=0 TSval=37595417 TSecr=37595417

Frame 1119: 66 bytes on wire (528 bits), 66 bytes captured (528 bits) on interface 0
Ethernet II, Src: 00:00:00_00:00:00 (00:00:00:00:00:00), Dst: 00:00:00_00:00:00 (00:00:00:00:00:00)
Internet Protocol Version 4, Src: 127.0.0.1, Dst: 127.0.0.1
Transmission Control Protocol, Src Port: 5011 (5011), Dst Port: 54958 (54958), Seq: 1, Ack: 317, Len: 0

No.     Time           Source                Destination           Protocol Length Info
   1120 42.652956736   127.0.0.1             127.0.0.1             TCP      83     [TCP segment of a reassembled PDU]

Frame 1120: 83 bytes on wire (664 bits), 83 bytes captured (664 bits) on interface 0
Ethernet II, Src: 00:00:00_00:00:00 (00:00:00:00:00:00), Dst: 00:00:00_00:00:00 (00:00:00:00:00:00)
Internet Protocol Version 4, Src: 127.0.0.1, Dst: 127.0.0.1
Transmission Control Protocol, Src Port: 5011 (5011), Dst Port: 54958 (54958), Seq: 1, Ack: 317, Len: 17

No.     Time           Source                Destination           Protocol Length Info
   1121 42.652960633   127.0.0.1             127.0.0.1             TCP      66     54958 → 5011 [ACK] Seq=317 Ack=18 Win=43776 Len=0 TSval=37595418 TSecr=37595418

Frame 1121: 66 bytes on wire (528 bits), 66 bytes captured (528 bits) on interface 0
Ethernet II, Src: 00:00:00_00:00:00 (00:00:00:00:00:00), Dst: 00:00:00_00:00:00 (00:00:00:00:00:00)
Internet Protocol Version 4, Src: 127.0.0.1, Dst: 127.0.0.1
Transmission Control Protocol, Src Port: 54958 (54958), Dst Port: 5011 (5011), Seq: 317, Ack: 18, Len: 0

No.     Time           Source                Destination           Protocol Length Info
   1122 42.653017649   127.0.0.1             127.0.0.1             TCP      382    [TCP segment of a reassembled PDU]

Frame 1122: 382 bytes on wire (3056 bits), 382 bytes captured (3056 bits) on interface 0
Ethernet II, Src: 00:00:00_00:00:00 (00:00:00:00:00:00), Dst: 00:00:00_00:00:00 (00:00:00:00:00:00)
Internet Protocol Version 4, Src: 127.0.0.1, Dst: 127.0.0.1
Transmission Control Protocol, Src Port: 5011 (5011), Dst Port: 54958 (54958), Seq: 18, Ack: 317, Len: 316

No.     Time           Source                Destination           Protocol Length Info
   1123 42.653020620   127.0.0.1             127.0.0.1             TCP      66     54958 → 5011 [ACK] Seq=317 Ack=334 Win=44800 Len=0 TSval=37595418 TSecr=37595418

Frame 1123: 66 bytes on wire (528 bits), 66 bytes captured (528 bits) on interface 0
Ethernet II, Src: 00:00:00_00:00:00 (00:00:00:00:00:00), Dst: 00:00:00_00:00:00 (00:00:00:00:00:00)
Internet Protocol Version 4, Src: 127.0.0.1, Dst: 127.0.0.1
Transmission Control Protocol, Src Port: 54958 (54958), Dst Port: 5011 (5011), Seq: 317, Ack: 334, Len: 0

No.     Time           Source                Destination           Protocol Length Info
   1124 42.653036088   127.0.0.1             127.0.0.1             TCP      8258   [TCP segment of a reassembled PDU]

Frame 1124: 8258 bytes on wire (66064 bits), 8258 bytes captured (66064 bits) on interface 0
Ethernet II, Src: 00:00:00_00:00:00 (00:00:00:00:00:00), Dst: 00:00:00_00:00:00 (00:00:00:00:00:00)
Internet Protocol Version 4, Src: 127.0.0.1, Dst: 127.0.0.1
Transmission Control Protocol, Src Port: 5011 (5011), Dst Port: 54958 (54958), Seq: 334, Ack: 317, Len: 8192

No.     Time           Source                Destination           Protocol Length Info
   1125 42.653039546   127.0.0.1             127.0.0.1             TCP      66     54958 → 5011 [ACK] Seq=317 Ack=8526 Win=175744 Len=0 TSval=37595418 TSecr=37595418

Frame 1125: 66 bytes on wire (528 bits), 66 bytes captured (528 bits) on interface 0
Ethernet II, Src: 00:00:00_00:00:00 (00:00:00:00:00:00), Dst: 00:00:00_00:00:00 (00:00:00:00:00:00)
Internet Protocol Version 4, Src: 127.0.0.1, Dst: 127.0.0.1
Transmission Control Protocol, Src Port: 54958 (54958), Dst Port: 5011 (5011), Seq: 317, Ack: 8526, Len: 0

No.     Time           Source                Destination           Protocol Length Info
   1126 42.653066511   127.0.0.1             127.0.0.1             TCP      8258   [TCP segment of a reassembled PDU]

Frame 1126: 8258 bytes on wire (66064 bits), 8258 bytes captured (66064 bits) on interface 0
Ethernet II, Src: 00:00:00_00:00:00 (00:00:00:00:00:00), Dst: 00:00:00_00:00:00 (00:00:00:00:00:00)
Internet Protocol Version 4, Src: 127.0.0.1, Dst: 127.0.0.1
Transmission Control Protocol, Src Port: 5011 (5011), Dst Port: 54958 (54958), Seq: 8526, Ack: 317, Len: 8192

No.     Time           Source                Destination           Protocol Length Info
   1127 42.653069721   127.0.0.1             127.0.0.1             TCP      66     54958 → 5011 [ACK] Seq=317 Ack=16718 Win=306816 Len=0 TSval=37595418 TSecr=37595418

Frame 1127: 66 bytes on wire (528 bits), 66 bytes captured (528 bits) on interface 0
Ethernet II, Src: 00:00:00_00:00:00 (00:00:00:00:00:00), Dst: 00:00:00_00:00:00 (00:00:00:00:00:00)
Internet Protocol Version 4, Src: 127.0.0.1, Dst: 127.0.0.1
Transmission Control Protocol, Src Port: 54958 (54958), Dst Port: 5011 (5011), Seq: 317, Ack: 16718, Len: 0

No.     Time           Source                Destination           Protocol Length Info
   1128 42.653090670   127.0.0.1             127.0.0.1             TCP      8258   [TCP segment of a reassembled PDU]

Frame 1128: 8258 bytes on wire (66064 bits), 8258 bytes captured (66064 bits) on interface 0
Ethernet II, Src: 00:00:00_00:00:00 (00:00:00:00:00:00), Dst: 00:00:00_00:00:00 (00:00:00:00:00:00)
Internet Protocol Version 4, Src: 127.0.0.1, Dst: 127.0.0.1
Transmission Control Protocol, Src Port: 5011 (5011), Dst Port: 54958 (54958), Seq: 16718, Ack: 317, Len: 8192

No.     Time           Source                Destination           Protocol Length Info
   1129 42.653094552   127.0.0.1             127.0.0.1             TCP      66     54958 → 5011 [ACK] Seq=317 Ack=24910 Win=437760 Len=0 TSval=37595418 TSecr=37595418

Frame 1129: 66 bytes on wire (528 bits), 66 bytes captured (528 bits) on interface 0
Ethernet II, Src: 00:00:00_00:00:00 (00:00:00:00:00:00), Dst: 00:00:00_00:00:00 (00:00:00:00:00:00)
Internet Protocol Version 4, Src: 127.0.0.1, Dst: 127.0.0.1
Transmission Control Protocol, Src Port: 54958 (54958), Dst Port: 5011 (5011), Seq: 317, Ack: 24910, Len: 0

No.     Time           Source                Destination           Protocol Length Info
   1130 42.653113445   127.0.0.1             127.0.0.1             TCP      8258   [TCP segment of a reassembled PDU]

Frame 1130: 8258 bytes on wire (66064 bits), 8258 bytes captured (66064 bits) on interface 0
Ethernet II, Src: 00:00:00_00:00:00 (00:00:00:00:00:00), Dst: 00:00:00_00:00:00 (00:00:00:00:00:00)
Internet Protocol Version 4, Src: 127.0.0.1, Dst: 127.0.0.1
Transmission Control Protocol, Src Port: 5011 (5011), Dst Port: 54958 (54958), Seq: 24910, Ack: 317, Len: 8192

No.     Time           Source                Destination           Protocol Length Info
   1131 42.653116561   127.0.0.1             127.0.0.1             TCP      66     54958 → 5011 [ACK] Seq=317 Ack=33102 Win=465536 Len=0 TSval=37595418 TSecr=37595418

Frame 1131: 66 bytes on wire (528 bits), 66 bytes captured (528 bits) on interface 0
Ethernet II, Src: 00:00:00_00:00:00 (00:00:00:00:00:00), Dst: 00:00:00_00:00:00 (00:00:00:00:00:00)
Internet Protocol Version 4, Src: 127.0.0.1, Dst: 127.0.0.1
Transmission Control Protocol, Src Port: 54958 (54958), Dst Port: 5011 (5011), Seq: 317, Ack: 33102, Len: 0

No.     Time           Source                Destination           Protocol Length Info
   1132 42.653136228   127.0.0.1             127.0.0.1             TCP      8258   [TCP segment of a reassembled PDU]

Frame 1132: 8258 bytes on wire (66064 bits), 8258 bytes captured (66064 bits) on interface 0
Ethernet II, Src: 00:00:00_00:00:00 (00:00:00:00:00:00), Dst: 00:00:00_00:00:00 (00:00:00:00:00:00)
Internet Protocol Version 4, Src: 127.0.0.1, Dst: 127.0.0.1
Transmission Control Protocol, Src Port: 5011 (5011), Dst Port: 54958 (54958), Seq: 33102, Ack: 317, Len: 8192

No.     Time           Source                Destination           Protocol Length Info
   1133 42.653139063   127.0.0.1             127.0.0.1             TCP      66     54958 → 5011 [ACK] Seq=317 Ack=41294 Win=465536 Len=0 TSval=37595418 TSecr=37595418

Frame 1133: 66 bytes on wire (528 bits), 66 bytes captured (528 bits) on interface 0
Ethernet II, Src: 00:00:00_00:00:00 (00:00:00:00:00:00), Dst: 00:00:00_00:00:00 (00:00:00:00:00:00)
Internet Protocol Version 4, Src: 127.0.0.1, Dst: 127.0.0.1
Transmission Control Protocol, Src Port: 54958 (54958), Dst Port: 5011 (5011), Seq: 317, Ack: 41294, Len: 0

No.     Time           Source                Destination           Protocol Length Info
   1134 42.653161043   127.0.0.1             127.0.0.1             TCP      8258   [TCP segment of a reassembled PDU]

Frame 1134: 8258 bytes on wire (66064 bits), 8258 bytes captured (66064 bits) on interface 0
Ethernet II, Src: 00:00:00_00:00:00 (00:00:00:00:00:00), Dst: 00:00:00_00:00:00 (00:00:00:00:00:00)
Internet Protocol Version 4, Src: 127.0.0.1, Dst: 127.0.0.1
Transmission Control Protocol, Src Port: 5011 (5011), Dst Port: 54958 (54958), Seq: 41294, Ack: 317, Len: 8192

No.     Time           Source                Destination           Protocol Length Info
   1135 42.653164771   127.0.0.1             127.0.0.1             TCP      66     54958 → 5011 [ACK] Seq=317 Ack=49486 Win=465536 Len=0 TSval=37595418 TSecr=37595418

Frame 1135: 66 bytes on wire (528 bits), 66 bytes captured (528 bits) on interface 0
Ethernet II, Src: 00:00:00_00:00:00 (00:00:00:00:00:00), Dst: 00:00:00_00:00:00 (00:00:00:00:00:00)
Internet Protocol Version 4, Src: 127.0.0.1, Dst: 127.0.0.1
Transmission Control Protocol, Src Port: 54958 (54958), Dst Port: 5011 (5011), Seq: 317, Ack: 49486, Len: 0

No.     Time           Source                Destination           Protocol Length Info
   1136 42.653183892   127.0.0.1             127.0.0.1             TCP      8258   [TCP segment of a reassembled PDU]

Frame 1136: 8258 bytes on wire (66064 bits), 8258 bytes captured (66064 bits) on interface 0
Ethernet II, Src: 00:00:00_00:00:00 (00:00:00:00:00:00), Dst: 00:00:00_00:00:00 (00:00:00:00:00:00)
Internet Protocol Version 4, Src: 127.0.0.1, Dst: 127.0.0.1
Transmission Control Protocol, Src Port: 5011 (5011), Dst Port: 54958 (54958), Seq: 49486, Ack: 317, Len: 8192

No.     Time           Source                Destination           Protocol Length Info
   1137 42.653186698   127.0.0.1             127.0.0.1             TCP      66     54958 → 5011 [ACK] Seq=317 Ack=57678 Win=465536 Len=0 TSval=37595418 TSecr=37595418

Frame 1137: 66 bytes on wire (528 bits), 66 bytes captured (528 bits) on interface 0
Ethernet II, Src: 00:00:00_00:00:00 (00:00:00:00:00:00), Dst: 00:00:00_00:00:00 (00:00:00:00:00:00)
Internet Protocol Version 4, Src: 127.0.0.1, Dst: 127.0.0.1
Transmission Control Protocol, Src Port: 54958 (54958), Dst Port: 5011 (5011), Seq: 317, Ack: 57678, Len: 0

No.     Time           Source                Destination           Protocol Length Info
   1138 42.653205527   127.0.0.1             127.0.0.1             TCP      8258   [TCP segment of a reassembled PDU]

Frame 1138: 8258 bytes on wire (66064 bits), 8258 bytes captured (66064 bits) on interface 0
Ethernet II, Src: 00:00:00_00:00:00 (00:00:00:00:00:00), Dst: 00:00:00_00:00:00 (00:00:00:00:00:00)
Internet Protocol Version 4, Src: 127.0.0.1, Dst: 127.0.0.1
Transmission Control Protocol, Src Port: 5011 (5011), Dst Port: 54958 (54958), Seq: 57678, Ack: 317, Len: 8192

No.     Time           Source                Destination           Protocol Length Info
   1139 42.653208328   127.0.0.1             127.0.0.1             TCP      66     54958 → 5011 [ACK] Seq=317 Ack=65870 Win=465536 Len=0 TSval=37595418 TSecr=37595418

Frame 1139: 66 bytes on wire (528 bits), 66 bytes captured (528 bits) on interface 0
Ethernet II, Src: 00:00:00_00:00:00 (00:00:00:00:00:00), Dst: 00:00:00_00:00:00 (00:00:00:00:00:00)
Internet Protocol Version 4, Src: 127.0.0.1, Dst: 127.0.0.1
Transmission Control Protocol, Src Port: 54958 (54958), Dst Port: 5011 (5011), Seq: 317, Ack: 65870, Len: 0

No.     Time           Source                Destination           Protocol Length Info
   1140 42.653228179   127.0.0.1             127.0.0.1             TCP      8258   [TCP segment of a reassembled PDU]

Frame 1140: 8258 bytes on wire (66064 bits), 8258 bytes captured (66064 bits) on interface 0
Ethernet II, Src: 00:00:00_00:00:00 (00:00:00:00:00:00), Dst: 00:00:00_00:00:00 (00:00:00:00:00:00)
Internet Protocol Version 4, Src: 127.0.0.1, Dst: 127.0.0.1
Transmission Control Protocol, Src Port: 5011 (5011), Dst Port: 54958 (54958), Seq: 65870, Ack: 317, Len: 8192

No.     Time           Source                Destination           Protocol Length Info
   1141 42.653231564   127.0.0.1             127.0.0.1             TCP      66     54958 → 5011 [ACK] Seq=317 Ack=74062 Win=465536 Len=0 TSval=37595418 TSecr=37595418

Frame 1141: 66 bytes on wire (528 bits), 66 bytes captured (528 bits) on interface 0
Ethernet II, Src: 00:00:00_00:00:00 (00:00:00:00:00:00), Dst: 00:00:00_00:00:00 (00:00:00:00:00:00)
Internet Protocol Version 4, Src: 127.0.0.1, Dst: 127.0.0.1
Transmission Control Protocol, Src Port: 54958 (54958), Dst Port: 5011 (5011), Seq: 317, Ack: 74062, Len: 0

No.     Time           Source                Destination           Protocol Length Info
   1142 42.653250421   127.0.0.1             127.0.0.1             TCP      8258   [TCP segment of a reassembled PDU]

Frame 1142: 8258 bytes on wire (66064 bits), 8258 bytes captured (66064 bits) on interface 0
Ethernet II, Src: 00:00:00_00:00:00 (00:00:00:00:00:00), Dst: 00:00:00_00:00:00 (00:00:00:00:00:00)
Internet Protocol Version 4, Src: 127.0.0.1, Dst: 127.0.0.1
Transmission Control Protocol, Src Port: 5011 (5011), Dst Port: 54958 (54958), Seq: 74062, Ack: 317, Len: 8192

No.     Time           Source                Destination           Protocol Length Info
   1143 42.653253762   127.0.0.1             127.0.0.1             TCP      66     54958 → 5011 [ACK] Seq=317 Ack=82254 Win=465536 Len=0 TSval=37595418 TSecr=37595418

Frame 1143: 66 bytes on wire (528 bits), 66 bytes captured (528 bits) on interface 0
Ethernet II, Src: 00:00:00_00:00:00 (00:00:00:00:00:00), Dst: 00:00:00_00:00:00 (00:00:00:00:00:00)
Internet Protocol Version 4, Src: 127.0.0.1, Dst: 127.0.0.1
Transmission Control Protocol, Src Port: 54958 (54958), Dst Port: 5011 (5011), Seq: 317, Ack: 82254, Len: 0

No.     Time           Source                Destination           Protocol Length Info
   1144 42.653274325   127.0.0.1             127.0.0.1             TCP      8258   [TCP segment of a reassembled PDU]

Frame 1144: 8258 bytes on wire (66064 bits), 8258 bytes captured (66064 bits) on interface 0
Ethernet II, Src: 00:00:00_00:00:00 (00:00:00:00:00:00), Dst: 00:00:00_00:00:00 (00:00:00:00:00:00)
Internet Protocol Version 4, Src: 127.0.0.1, Dst: 127.0.0.1
Transmission Control Protocol, Src Port: 5011 (5011), Dst Port: 54958 (54958), Seq: 82254, Ack: 317, Len: 8192

No.     Time           Source                Destination           Protocol Length Info
   1145 42.653277312   127.0.0.1             127.0.0.1             TCP      66     54958 → 5011 [ACK] Seq=317 Ack=90446 Win=465536 Len=0 TSval=37595418 TSecr=37595418

Frame 1145: 66 bytes on wire (528 bits), 66 bytes captured (528 bits) on interface 0
Ethernet II, Src: 00:00:00_00:00:00 (00:00:00:00:00:00), Dst: 00:00:00_00:00:00 (00:00:00:00:00:00)
Internet Protocol Version 4, Src: 127.0.0.1, Dst: 127.0.0.1
Transmission Control Protocol, Src Port: 54958 (54958), Dst Port: 5011 (5011), Seq: 317, Ack: 90446, Len: 0

No.     Time           Source                Destination           Protocol Length Info
   1146 42.653296854   127.0.0.1             127.0.0.1             TCP      8258   [TCP segment of a reassembled PDU]

Frame 1146: 8258 bytes on wire (66064 bits), 8258 bytes captured (66064 bits) on interface 0
Ethernet II, Src: 00:00:00_00:00:00 (00:00:00:00:00:00), Dst: 00:00:00_00:00:00 (00:00:00:00:00:00)
Internet Protocol Version 4, Src: 127.0.0.1, Dst: 127.0.0.1
Transmission Control Protocol, Src Port: 5011 (5011), Dst Port: 54958 (54958), Seq: 90446, Ack: 317, Len: 8192

No.     Time           Source                Destination           Protocol Length Info
   1147 42.653300078   127.0.0.1             127.0.0.1             TCP      66     54958 → 5011 [ACK] Seq=317 Ack=98638 Win=465536 Len=0 TSval=37595418 TSecr=37595418

Frame 1147: 66 bytes on wire (528 bits), 66 bytes captured (528 bits) on interface 0
Ethernet II, Src: 00:00:00_00:00:00 (00:00:00:00:00:00), Dst: 00:00:00_00:00:00 (00:00:00:00:00:00)
Internet Protocol Version 4, Src: 127.0.0.1, Dst: 127.0.0.1
Transmission Control Protocol, Src Port: 54958 (54958), Dst Port: 5011 (5011), Seq: 317, Ack: 98638, Len: 0

No.     Time           Source                Destination           Protocol Length Info
   1148 42.653319340   127.0.0.1             127.0.0.1             TCP      8258   [TCP segment of a reassembled PDU]

Frame 1148: 8258 bytes on wire (66064 bits), 8258 bytes captured (66064 bits) on interface 0
Ethernet II, Src: 00:00:00_00:00:00 (00:00:00:00:00:00), Dst: 00:00:00_00:00:00 (00:00:00:00:00:00)
Internet Protocol Version 4, Src: 127.0.0.1, Dst: 127.0.0.1
Transmission Control Protocol, Src Port: 5011 (5011), Dst Port: 54958 (54958), Seq: 98638, Ack: 317, Len: 8192

No.     Time           Source                Destination           Protocol Length Info
   1149 42.653322642   127.0.0.1             127.0.0.1             TCP      66     54958 → 5011 [ACK] Seq=317 Ack=106830 Win=465536 Len=0 TSval=37595418 TSecr=37595418

Frame 1149: 66 bytes on wire (528 bits), 66 bytes captured (528 bits) on interface 0
Ethernet II, Src: 00:00:00_00:00:00 (00:00:00:00:00:00), Dst: 00:00:00_00:00:00 (00:00:00:00:00:00)
Internet Protocol Version 4, Src: 127.0.0.1, Dst: 127.0.0.1
Transmission Control Protocol, Src Port: 54958 (54958), Dst Port: 5011 (5011), Seq: 317, Ack: 106830, Len: 0

No.     Time           Source                Destination           Protocol Length Info
   1150 42.653341987   127.0.0.1             127.0.0.1             TCP      8258   [TCP segment of a reassembled PDU]

Frame 1150: 8258 bytes on wire (66064 bits), 8258 bytes captured (66064 bits) on interface 0
Ethernet II, Src: 00:00:00_00:00:00 (00:00:00:00:00:00), Dst: 00:00:00_00:00:00 (00:00:00:00:00:00)
Internet Protocol Version 4, Src: 127.0.0.1, Dst: 127.0.0.1
Transmission Control Protocol, Src Port: 5011 (5011), Dst Port: 54958 (54958), Seq: 106830, Ack: 317, Len: 8192

No.     Time           Source                Destination           Protocol Length Info
   1151 42.653344831   127.0.0.1             127.0.0.1             TCP      66     54958 → 5011 [ACK] Seq=317 Ack=115022 Win=465536 Len=0 TSval=37595418 TSecr=37595418

Frame 1151: 66 bytes on wire (528 bits), 66 bytes captured (528 bits) on interface 0
Ethernet II, Src: 00:00:00_00:00:00 (00:00:00:00:00:00), Dst: 00:00:00_00:00:00 (00:00:00:00:00:00)
Internet Protocol Version 4, Src: 127.0.0.1, Dst: 127.0.0.1
Transmission Control Protocol, Src Port: 54958 (54958), Dst Port: 5011 (5011), Seq: 317, Ack: 115022, Len: 0

No.     Time           Source                Destination           Protocol Length Info
   1152 42.653365196   127.0.0.1             127.0.0.1             HTTP     6638   HTTP/1.0 200 OK  (text/css)

Frame 1152: 6638 bytes on wire (53104 bits), 6638 bytes captured (53104 bits) on interface 0
Ethernet II, Src: 00:00:00_00:00:00 (00:00:00:00:00:00), Dst: 00:00:00_00:00:00 (00:00:00:00:00:00)
Internet Protocol Version 4, Src: 127.0.0.1, Dst: 127.0.0.1
Transmission Control Protocol, Src Port: 5011 (5011), Dst Port: 54958 (54958), Seq: 115022, Ack: 317, Len: 6572
[17 Reassembled TCP Segments (121593 bytes): #1120(17), #1122(316), #1124(8192), #1126(8192), #1128(8192), #1130(8192), #1132(8192), #1134(8192), #1136(8192), #1138(8192), #1140(8192), #1142(8192), #1144(8192), #1146(8192), #1148(8192), #11]
Hypertext Transfer Protocol
    HTTP/1.0 200 OK\r\n
    Content-Length: 121260\r\n
    Content-Type: text/css; charset=utf-8\r\n
    Last-Modified: Wed, 06 Jan 2016 15:55:22 GMT\r\n
    Cache-Control: public, max-age=43200\r\n
    Expires: Thu, 17 Mar 2016 05:12:45 GMT\r\n
    ETag: "flask-1452095722.3636904-121260-2046764012"\r\n
    Date: Wed, 16 Mar 2016 17:12:45 GMT\r\n
    Server: Werkzeug/0.11.4 Python/3.5.1\r\n
    \r\n
    [HTTP response 1/1]
    [Time since request: 0.001735854 seconds]
    [Request in frame: 1118]
Line-based text data: text/css
    /*!\n
     * Bootstrap v3.3.6 (http://getbootstrap.com)\n
     * Copyright 2011-2015 Twitter, Inc.\n
